{
  "$schema": "https://json-schema.org/draft/2020-12/schema",
  "$id": "https://oab.run/schemas/reasoning-trace.schema.json",
  "title": "OAB Reasoning Trace",
  "description": "The auditable chain behind one architectural decision: inputs, assumptions, knowledge consulted, options weighed, the choice, and the conditions that would reverse it. This is what lets a developer disagree with a specific link rather than accept or reject a conclusion whole.",
  "type": "object",
  "additionalProperties": false,
  "required": ["decision", "stage", "complexity_budget", "assumptions", "options", "confidence"],
  "properties": {
    "decision": {
      "type": "string",
      "minLength": 3,
      "description": "What is being decided, e.g. 'Primary datastore'."
    },
    "stage": {
      "type": "string",
      "enum": ["0", "1", "2", "3", "4", "5"],
      "description": "Maturity stage of the system. Filters knowledge retrieval, so stage-4 machinery cannot be offered to a stage-1 system."
    },
    "complexity_budget": {
      "type": "object",
      "additionalProperties": false,
      "required": ["available", "spent"],
      "properties": {
        "available": { "type": "number", "minimum": 0 },
        "spent": { "type": "number", "minimum": 0 },
        "override": {
          "type": "object",
          "additionalProperties": false,
          "required": ["justification", "mitigation"],
          "properties": {
            "justification": { "type": "string", "minLength": 20 },
            "mitigation": {
              "type": "string",
              "minLength": 10,
              "description": "What is being dropped, who will operate the excess, or which engineer is being hired. An override without one of these is a wish."
            }
          },
          "description": "Required when spent exceeds available. Going over budget is allowed; going over silently is not."
        }
      }
    },
    "inputs": {
      "type": "array",
      "items": {
        "type": "object",
        "additionalProperties": false,
        "required": ["fact", "value", "source", "confidence"],
        "properties": {
          "fact": { "type": "string", "minLength": 1 },
          "value": { "type": ["number", "string", "boolean"] },
          "unit": { "type": "string" },
          "source": { "type": "string", "enum": ["observed", "stated", "assumed", "calculated"] },
          "confidence": { "type": "string", "enum": ["high", "medium", "low"] }
        }
      }
    },
    "assumptions": {
      "type": "array",
      "minItems": 1,
      "description": "Never empty and never hidden. A user who can see the assumptions can correct the input instead of distrusting the tool.",
      "items": {
        "type": "object",
        "additionalProperties": false,
        "required": ["text", "confidence"],
        "properties": {
          "text": { "type": "string", "minLength": 5 },
          "confidence": { "type": "string", "enum": ["high", "medium", "low"] },
          "impact": { "type": "string", "description": "How much the answer moves if this is wrong." }
        }
      }
    },
    "knowledge_used": {
      "type": "array",
      "items": { "type": "string", "pattern": "^[a-z0-9]+(-[a-z0-9]+)*$" },
      "uniqueItems": true,
      "description": "Ids of the knowledge units consulted, so the reasoning can be traced back to its sources."
    },
    "options": {
      "type": "array",
      "minItems": 2,
      "description": "At least two, and one of them must be the simplest viable option — stated fairly, not as a straw man. Most architecture failure is failing to consider 'just use the database you already have'.",
      "items": {
        "type": "object",
        "additionalProperties": false,
        "required": ["id", "complexity_cost", "verdict"],
        "properties": {
          "id": { "type": "string", "minLength": 1 },
          "description": { "type": "string" },
          "components": { "type": "array", "items": { "type": "string" } },
          "complexity_cost": { "type": "number", "minimum": 0 },
          "monthly_cost": {
            "type": "object",
            "additionalProperties": false,
            "required": ["currency"],
            "properties": {
              "currency": { "type": "string", "minLength": 3, "maxLength": 3 },
              "low": { "type": "number", "minimum": 0 },
              "high": { "type": "number", "minimum": 0 }
            }
          },
          "reversibility": {
            "type": "string",
            "enum": ["easy", "moderate", "hard", "one-way"],
            "description": "A reversible decision made quickly usually beats a perfect decision made slowly. One-way doors deserve more analysis."
          },
          "verdict": { "type": "string", "enum": ["selected", "rejected", "deferred"] },
          "reason": {
            "type": "string",
            "description": "For a rejected option, the measurement that would change the answer — not merely why it lost."
          },
          "trade_offs": {
            "type": "array",
            "items": { "type": "string" },
            "description": "Never empty for the selected option. An option with no downsides has not been understood."
          }
        }
      }
    },
    "confidence": { "type": "string", "enum": ["high", "medium", "low"] },
    "triggers": {
      "type": "array",
      "items": { "type": "string", "pattern": "^[a-z0-9]+(-[a-z0-9]+)*$" },
      "description": "Ids of the evolution triggers that would reopen this decision."
    },
    "capacity_results": {
      "type": "array",
      "items": { "$ref": "https://oab.run/schemas/capacity-result.schema.json" }
    }
  },
  "allOf": [
    {
      "if": {
        "properties": { "options": { "contains": { "properties": { "verdict": { "const": "selected" } }, "required": ["verdict"] } } },
        "required": ["options"]
      },
      "then": {
        "properties": {
          "options": {
            "contains": {
              "properties": { "verdict": { "const": "rejected" } },
              "required": ["verdict"]
            }
          }
        },
        "description": "A trace with a selection must also record a rejection. If nothing was rejected, no alternative was genuinely considered."
      }
    }
  ]
}
